{
  "$schema": "https://json-schema.org/draft/2020-12/schema",
  "$id": "https://smartperfetto.dev/schemas/trace-scenario-v1.json",
  "title": "SmartPerfetto Constructed Trace Scenario",
  "type": "object",
  "additionalProperties": false,
  "required": ["schema_version", "clock", "actors", "signals"],
  "properties": {
    "schema_version": {"const": 1},
    "clock": {
      "type": "object",
      "additionalProperties": false,
      "required": ["anchor", "duration_ns"],
      "properties": {
        "anchor": {"enum": ["trace-start", "trace-middle", "trace-end"]},
        "duration_ns": {"type": "string", "pattern": "^[1-9][0-9]*$"}
      }
    },
    "actors": {
      "type": "object",
      "additionalProperties": false,
      "required": ["processes", "threads"],
      "properties": {
        "processes": {
          "type": "array",
          "items": {
            "type": "object",
            "additionalProperties": false,
            "required": ["id", "name"],
            "properties": {
              "id": {"type": "string", "minLength": 1},
              "name": {"type": "string", "minLength": 1},
              "uid": {"type": "integer", "minimum": 0}
            }
          }
        },
        "threads": {
          "type": "array",
          "items": {
            "type": "object",
            "additionalProperties": false,
            "required": ["id", "process", "name"],
            "properties": {
              "id": {"type": "string", "minLength": 1},
              "process": {"type": "string", "minLength": 1},
              "name": {"type": "string", "minLength": 1},
              "is_main": {"type": "boolean"}
            }
          }
        }
      }
    },
    "signals": {
      "type": "array",
      "items": {
        "type": "object",
        "required": ["type", "at_ns"],
        "properties": {
          "type": {
            "enum": [
              "atrace-track-instant", "android-input-motion", "android-input-dispatch",
              "atrace-slice", "atrace-counter", "atrace-async-slice", "atrace-async-track-slice",
              "sched-running", "sched-switch", "sched-waking", "process-stats", "battery-counters", "power-rail",
              "gpu-work-period", "gpu-frequency", "gpu-memory-total", "gpu-power-state", "cpu-frequency", "cpu-idle",
              "cpu-frequency-limits", "thermal-temperature", "cdev-update",
              "irq-span", "frame-timeline", "lmk-kill", "managed-heap-graph",
              "gpu-compute-kernel", "anr-event", "perf-sample", "android-log",
              "statsd-atom", "battery-stats-span", "android-process-state-snapshot", "android-process-state-change",
              "android-system-info", "android-network-packet", "android-packages-list",
              "sched-blocked-reason"
            ]
          },
          "at_ns": {"type": "string", "pattern": "^[0-9]+$"},
          "duration_ns": {"type": "string", "pattern": "^[0-9]+$"},
          "process": {"type": "string"},
          "thread": {"type": "string"},
          "prev_thread": {"type": ["string", "null"], "description": "Explicit sched-switch source actor; null denotes idle."},
          "next_thread": {"type": ["string", "null"], "description": "Explicit sched-switch destination actor; null denotes idle."},
          "waker_thread": {"type": ["string", "null"]},
          "irq_context": {"enum": ["hardirq", "softirq"], "description": "sched-waking raised from interrupt context: sets the ftrace common_flags bit trace processor reads as thread_state.irq_context."},
          "direction": {"enum": ["received", "transmitted"], "description": "android-network-packet traffic direction."},
          "interface": {"type": "string", "minLength": 1, "description": "android-network-packet network interface name."},
          "length": {"type": "integer", "minimum": 1, "maximum": 4294967295, "description": "android-network-packet length in bytes."},
          "owner_process": {"type": "string", "description": "Actor whose uid owns a battery-stats-span or an android-network-packet socket."},
          "io_wait": {"type": "boolean", "description": "sched-blocked-reason: whether the thread's latest D state waited on IO."},
          "packages": {
            "type": "array",
            "minItems": 1,
            "description": "android-packages-list entries: a package name for an actor's uid.",
            "items": {
              "type": "object",
              "additionalProperties": false,
              "required": ["name", "process"],
              "properties": {
                "name": {"type": "string", "minLength": 1},
                "process": {"type": "string", "minLength": 1}
              }
            }
          },
          "prev_priority": {"type": "integer", "minimum": -1, "maximum": 139},
          "next_priority": {"type": "integer", "minimum": -1, "maximum": 139},
          "sched_priority": {"type": "integer", "minimum": -1, "maximum": 139},
          "prev_state_raw": {"type": "string", "pattern": "^[0-9]+$", "description": "Raw kernel sched_switch prev_state bitmask. The base trace kernel version controls decoding: modern kernels (4.14+) use 256 for R+; missing kernel metadata defaults to 4.4 and uses 2048. No policy is inferred from this field or priority."},
          "target_cpu": {"type": "integer", "minimum": 0},
          "event_id": {"type": "integer", "minimum": 0, "maximum": 4294967295},
          "device_id": {"type": "integer", "minimum": -2147483648, "maximum": 2147483647},
          "display_id": {"type": "integer", "minimum": -2147483648, "maximum": 2147483647},
          "window_id": {"type": "integer", "minimum": -2147483648, "maximum": 2147483647},
          "source": {"type": "integer", "minimum": 0, "maximum": 4294967295},
          "action": {"type": "integer", "minimum": -2147483648, "maximum": 2147483647},
          "vsync_id": {"type": "string", "pattern": "^-?[0-9]+$"},
          "target_process": {"type": "string"},
          "atom": {"enum": ["app_standby_bucket_changed", "app_freeze_changed"], "description": "Statsd atom grafted from the pinned trace processor atoms.descriptor."},
          "fields": {"type": "object", "description": "Statsd atom fields by snake_case proto name; enum fields take value names."},
          "event": {"enum": ["longwake"], "description": "BatteryStats history event for battery-stats-span."},
          "records": {
            "type": "array",
            "minItems": 1,
            "items": {
              "type": "object",
              "additionalProperties": false,
              "required": ["process", "proc_state"],
              "properties": {
                "process": {"type": "string", "minLength": 1},
                "proc_state": {"type": "string", "pattern": "^PROCESS_STATE_[A-Z_]+$"},
                "oom_score": {"type": "integer", "minimum": -2147483648, "maximum": 2147483647}
              }
            }
          },
          "prev_proc_state": {"type": "string", "pattern": "^PROCESS_STATE_[A-Z_]+$"},
          "cur_proc_state": {"type": "string", "pattern": "^PROCESS_STATE_[A-Z_]+$"},
          "prev_oom_score": {"type": "integer", "minimum": -2147483648, "maximum": 2147483647},
          "cur_oom_score": {"type": "integer", "minimum": -2147483648, "maximum": 2147483647},
          "reason": {"type": "string", "pattern": "^OOM_ADJ_REASON_[A-Z_]+$"},
          "seq_id": {"type": "integer", "minimum": 0},
          "name": {"type": "string"},
          "error_id": {"type": "string", "minLength": 1},
          "subject": {"type": "string", "minLength": 1},
          "function_name": {"type": "string", "minLength": 1},
          "module_name": {"type": "string", "minLength": 1},
          "log_id": {"enum": ["MAIN", "RADIO", "EVENTS", "SYSTEM", "CRASH"]},
          "priority": {"enum": ["VERBOSE", "DEBUG", "INFO", "WARN", "ERROR", "FATAL"]},
          "tag": {"type": "string", "minLength": 1},
          "message": {"type": "string", "minLength": 1},
          "sample_count": {"type": "integer", "minimum": 1, "maximum": 1000},
          "sample_interval_ns": {"type": "string", "pattern": "^[1-9][0-9]*$"},
          "track_name": {"type": "string"},
          "subsystem": {"type": "string"},
          "layer_name": {"type": "string"},
          "value": {"type": "number"},
          "cpu": {"type": "integer", "minimum": 0},
          "cpu_id": {"type": "integer", "minimum": 0},
          "min_freq_khz": {"type": "integer", "minimum": 0, "maximum": 4294967295},
          "max_freq_khz": {"type": "integer", "minimum": 0, "maximum": 4294967295},
          "thermal_zone": {"type": "string", "minLength": 1},
          "temp_mc": {"type": "integer", "minimum": -2147483648, "maximum": 2147483647, "description": "Thermal zone temperature in millidegrees Celsius, as the kernel reports it."},
          "temp_prev_mc": {"type": "integer", "minimum": -2147483648, "maximum": 2147483647},
          "id": {"type": "integer", "minimum": 0, "maximum": 2147483647, "description": "Kernel thermal zone id for thermal-temperature."},
          "cdev_type": {"type": "string", "minLength": 1, "description": "Cooling device type string; trace_processor names the counter track after it."},
          "target": {"type": "integer", "minimum": 0, "maximum": 9007199254740991},
          "gpu_id": {"type": "integer", "minimum": 0},
          "size_bytes": {"type": "string", "pattern": "^[0-9]+$", "description": "gpu-memory-total: GPU memory in bytes; with process, that process's share, else the device total."},
          "uid": {"type": "integer", "minimum": 0},
          "irq": {"type": "integer", "minimum": 0},
          "cookie": {"type": "integer", "minimum": 0},
          "token": {"type": "integer", "minimum": 0},
          "display_frame_token": {"type": "integer", "minimum": -1, "description": "frame-timeline display frame token; -1 marks a frame the device inserted (OEM frame interpolation)."},
          "jank_type": {"type": "integer", "minimum": 0},
          "old_state": {"type": "integer", "minimum": 0},
          "new_state": {"type": "integer", "minimum": 0},
          "state": {"type": "integer", "minimum": 0},
          "kill_reason": {"type": "integer", "minimum": 0},
          "oom_score_adj": {"type": "integer"},
          "vm_rss_kb": {"type": "integer", "minimum": 0},
          "rss_anon_kb": {"type": "integer", "minimum": 0},
          "rss_file_kb": {"type": "integer", "minimum": 0},
          "rss_shmem_kb": {"type": "integer", "minimum": 0},
          "vm_swap_kb": {"type": "integer", "minimum": 0},
          "vm_hwm_kb": {"type": "integer", "minimum": 0},
          "capacity_percent": {"type": "number"},
          "charge_counter_uah": {"type": "string", "pattern": "^-?[0-9]+$"},
          "current_ua": {"type": "string", "pattern": "^-?[0-9]+$"},
          "current_avg_ua": {"type": "string", "pattern": "^-?[0-9]+$"},
          "energy_counter_uwh": {"type": "string", "pattern": "^-?[0-9]+$"},
          "voltage_uv": {"type": "string", "pattern": "^-?[0-9]+$"},
          "start_energy_uws": {"type": "string", "pattern": "^[0-9]+$"},
          "end_energy_uws": {"type": "string", "pattern": "^[0-9]+$"},
          "active_duration_ns": {"type": "string", "pattern": "^[0-9]+$"},
          "end_state": {"enum": ["R", "S", "D"]},
          "heap_bytes_allocated": {"type": "string", "pattern": "^[0-9]+$"},
          "types": {
            "type": "array",
            "minItems": 1,
            "maxItems": 5000,
            "items": {
              "type": "object",
              "additionalProperties": false,
              "required": ["id", "class_name", "object_size"],
              "properties": {
                "id": {"type": "integer", "minimum": 1},
                "class_name": {"type": "string", "minLength": 1},
                "object_size": {"type": "integer", "minimum": 0}
              }
            }
          },
          "objects": {
            "type": "array",
            "minItems": 1,
            "maxItems": 10000,
            "items": {
              "type": "object",
              "additionalProperties": false,
              "required": ["id", "type_id", "self_size", "reference_object_ids"],
              "properties": {
                "id": {"type": "integer", "minimum": 1},
                "type_id": {"type": "integer", "minimum": 1},
                "self_size": {"type": "integer", "minimum": 0},
                "reference_object_ids": {
                  "type": "array",
                  "items": {"type": "integer", "minimum": 1}
                }
              }
            }
          },
          "roots": {
            "type": "array",
            "minItems": 1,
            "maxItems": 1000,
            "items": {
              "type": "object",
              "additionalProperties": false,
              "required": ["root_type", "object_ids"],
              "properties": {
                "root_type": {
                  "enum": [
                    "ROOT_UNKNOWN", "ROOT_JNI_GLOBAL", "ROOT_JNI_LOCAL", "ROOT_JAVA_FRAME",
                    "ROOT_NATIVE_STACK", "ROOT_STICKY_CLASS", "ROOT_THREAD_BLOCK", "ROOT_MONITOR_USED",
                    "ROOT_THREAD_OBJECT", "ROOT_INTERNED_STRING", "ROOT_FINALIZING", "ROOT_DEBUGGER",
                    "ROOT_REFERENCE_CLEANUP", "ROOT_VM_INTERNAL", "ROOT_JNI_MONITOR"
                  ]
                },
                "object_ids": {
                  "type": "array",
                  "minItems": 1,
                  "items": {"type": "integer", "minimum": 1}
                }
              }
            }
          },
          "android_build_fingerprint": {"type": "string", "minLength": 1, "description": "android-system-info: SystemInfo.android_build_fingerprint."},
          "android_device_manufacturer": {"type": "string", "minLength": 1, "description": "android-system-info: SystemInfo.android_device_manufacturer."},
          "android_soc_model": {"type": "string", "minLength": 1, "description": "android-system-info: SystemInfo.android_soc_model."},
          "android_sdk_version": {"type": "integer", "minimum": 1, "description": "android-system-info: SystemInfo.android_sdk_version."},
          "context": {"type": "string", "pattern": "^[1-9][0-9]*$"},
          "kernel": {"type": "string", "minLength": 1},
          "demangled_kernel": {"type": "string", "minLength": 1},
          "arch": {"type": "string", "minLength": 1},
          "grid": {"$ref": "#/$defs/computeDimensions"},
          "workgroup": {"$ref": "#/$defs/computeDimensions"},
          "args": {
            "type": "object",
            "maxProperties": 64,
            "additionalProperties": {"type": "integer", "minimum": 0}
          }
        },
        "allOf": [
          {
            "if": {"properties": {"type": {"const": "atrace-track-instant"}}},
            "then": {"required": ["process", "thread", "track_name", "name"]}
          },
          {
            "if": {"properties": {"type": {"const": "android-input-motion"}}},
            "then": {"required": ["event_id", "device_id", "display_id", "source", "action"]}
          },
          {
            "if": {"properties": {"type": {"const": "android-input-dispatch"}}},
            "then": {"required": ["event_id", "window_id", "vsync_id"]}
          },
          {
            "if": {"properties": {"type": {"const": "gpu-memory-total"}}},
            "then": {"required": ["gpu_id", "size_bytes"]}
          },
          {
            "if": {"properties": {"type": {"const": "sched-switch"}}},
            "then": {"required": ["cpu", "prev_thread", "next_thread", "prev_priority", "next_priority", "prev_state_raw"]}
          },
          {
            "if": {"properties": {"type": {"const": "sched-waking"}}},
            "then": {"required": ["cpu", "thread", "waker_thread", "target_cpu", "sched_priority"]}
          },
          {
            "if": {"properties": {"type": {"const": "android-network-packet"}}},
            "then": {"required": ["direction", "interface", "length", "owner_process"]}
          },
          {
            "if": {"properties": {"type": {"const": "sched-blocked-reason"}}},
            "then": {"required": ["thread", "io_wait"]}
          },
          {
            "if": {"properties": {"type": {"const": "android-packages-list"}}},
            "then": {"required": ["packages"]}
          },
          {
            "if": {"properties": {"type": {"const": "cpu-frequency-limits"}}},
            "then": {"required": ["cpu_id", "min_freq_khz", "max_freq_khz"]}
          },
          {
            "if": {"properties": {"type": {"const": "thermal-temperature"}}},
            "then": {"required": ["thermal_zone", "temp_mc"]}
          },
          {
            "if": {"properties": {"type": {"const": "cdev-update"}}},
            "then": {"required": ["cdev_type", "target"]}
          },
          {
            "if": {"properties": {"type": {"const": "statsd-atom"}}},
            "then": {"required": ["atom", "fields"]}
          },
          {
            "if": {"properties": {"type": {"const": "battery-stats-span"}}},
            "then": {"required": ["process", "thread", "duration_ns", "event", "owner_process", "tag"]}
          },
          {
            "if": {"properties": {"type": {"const": "android-system-info"}}},
            "then": {
              "anyOf": [
                {"required": ["android_build_fingerprint"]},
                {"required": ["android_device_manufacturer"]},
                {"required": ["android_soc_model"]},
                {"required": ["android_sdk_version"]}
              ]
            }
          },
          {
            "if": {"properties": {"type": {"const": "android-process-state-snapshot"}}},
            "then": {"required": ["records"]}
          },
          {
            "if": {"properties": {"type": {"const": "android-process-state-change"}}},
            "then": {"required": ["thread", "target_process", "prev_proc_state", "cur_proc_state"]}
          },
          {
            "if": {"properties": {"type": {"const": "managed-heap-graph"}}},
            "then": {"required": ["process", "heap_bytes_allocated", "types", "objects", "roots"]}
          },
          {
            "if": {"properties": {"type": {"const": "gpu-compute-kernel"}}},
            "then": {
              "required": [
                "process", "duration_ns", "gpu_id", "context", "kernel",
                "demangled_kernel", "arch", "grid", "workgroup", "args"
              ]
            }
          },
          {
            "if": {"properties": {"type": {"const": "anr-event"}}},
            "then": {"required": ["process", "thread", "target_process", "error_id", "subject"]}
          },
          {
            "if": {"properties": {"type": {"const": "perf-sample"}}},
            "then": {
              "required": [
                "process", "thread", "function_name", "module_name",
                "sample_count", "sample_interval_ns"
              ]
            }
          },
          {
            "if": {"properties": {"type": {"const": "android-log"}}},
            "then": {
              "required": [
                "process", "thread", "log_id", "priority", "tag", "message"
              ]
            }
          }
        ]
      }
    }
  },
  "$defs": {
    "computeDimensions": {
      "type": "object",
      "additionalProperties": false,
      "required": ["x", "y", "z"],
      "properties": {
        "x": {"type": "integer", "minimum": 1, "maximum": 4294967295},
        "y": {"type": "integer", "minimum": 1, "maximum": 4294967295},
        "z": {"type": "integer", "minimum": 1, "maximum": 4294967295}
      }
    }
  }
}
