{
  "schema_version": 1,
  "clock": {
    "anchor": "trace-middle",
    "duration_ns": "1000000000"
  },
  "actors": {
    "processes": [
      {
        "id": "app",
        "name": "com.smartperfetto.fixture",
        "uid": 10999
      },
      {
        "id": "system",
        "name": "system_server",
        "uid": 1000
      },
      {
        "id": "sf",
        "name": "/system/bin/surfaceflinger",
        "uid": 1000
      }
    ],
    "threads": [
      {
        "id": "main",
        "process": "app",
        "name": "main",
        "is_main": true
      },
      {
        "id": "render",
        "process": "app",
        "name": "RenderThread"
      },
      {
        "id": "game",
        "process": "app",
        "name": "GameThread"
      },
      {
        "id": "rn-js",
        "process": "app",
        "name": "mqt_js"
      },
      {
        "id": "rn-native",
        "process": "app",
        "name": "mqt_native_modules"
      },
      {
        "id": "webview",
        "process": "app",
        "name": "CrRendererMain"
      },
      {
        "id": "system-main",
        "process": "system",
        "name": "android.fg",
        "is_main": true
      },
      {
        "id": "sf-main",
        "process": "sf",
        "name": "surfaceflinger",
        "is_main": true
      }
    ]
  },
  "signals": [
    {
      "type": "atrace-slice",
      "at_ns": "10000000",
      "duration_ns": "18000000",
      "process": "app",
      "thread": "main",
      "name": "SmartPerfetto::CASE::general-runtime-contracts"
    },
    {
      "type": "atrace-slice",
      "at_ns": "40000000",
      "duration_ns": "19000000",
      "process": "app",
      "thread": "render",
      "name": "SmartPerfetto::general-analysis"
    },
    {
      "type": "atrace-slice",
      "at_ns": "70000000",
      "duration_ns": "20000000",
      "process": "app",
      "thread": "main",
      "name": "trace overview"
    },
    {
      "type": "atrace-slice",
      "at_ns": "100000000",
      "duration_ns": "21000000",
      "process": "app",
      "thread": "render",
      "name": "comparison baseline"
    },
    {
      "type": "atrace-counter",
      "at_ns": "250000000",
      "process": "app",
      "thread": "main",
      "name": "SmartPerfetto.general-runtime-contracts.pressure",
      "value": 73
    },
    {
      "type": "sched-running",
      "at_ns": "300000000",
      "duration_ns": "45000000",
      "thread": "main",
      "cpu": 0,
      "end_state": "S"
    },
    {
      "type": "sched-running",
      "at_ns": "380000000",
      "duration_ns": "20000000",
      "thread": "main",
      "cpu": 0,
      "end_state": "S"
    },
    {
      "type": "sched-running",
      "at_ns": "50000000",
      "duration_ns": "100000000",
      "thread": "main",
      "cpu": 0,
      "end_state": "S"
    },
    {
      "type": "perf-sample",
      "at_ns": "700000000",
      "process": "app",
      "thread": "main",
      "function_name": "SmartPerfettoSyntheticHotFunction",
      "module_name": "libsmartperfetto_fixture.so",
      "sample_count": 12,
      "sample_interval_ns": "1000000",
      "cpu": 0
    }
  ]
}
